ticker,name,price,marketcap,volume,volumeavg,priceopen,low,high,close,change,changepct,closeyest,date,high52,low52,beta,shares,pe,eps,sector,industry,description,exchange,ceo,country,ipodate,isEtf,isFund,isActive,web_url,image,currency,employees,city,state,phone,address,dividend_yield,fetched_at
ANET,"Arista Networks, Inc.",141.58,178273206272,8777331,8622214,139.58,137.0,142.4999,141.58,-0.12999999999999545,-0.0917,141.71,2026-05-19,179.8,83.858,1.673,1259169438,48.65292,2.91,Technology,Computer Hardware,"Arista Networks, Inc. engages in the development, marketing, and sale of data-driven, client to cloud networking solutions for AI, data center, campus, and routing environments in the Americas, Europe, the Middle East, Africa, and the Asia-Pacific. Its cloud networking solutions consist of Extensible Operating System (EOS), a publish-subscribe state-sharing networking operating system offered in combination with a set of network applications. The company offers data center, cloud and AI networking, cognitive adjacencies, and cognitive network software and services. It also provides post contract customer support services, such as technical support, hardware repair and replacement parts beyond standard warranty, bug fixes, patches, and upgrade services. The company serves a range of industries comprising internet companies, cloud service providers, financial services organizations, government agencies, media and entertainment, healthcare, oil and gas, education, manufacturing, industria",NYQ,Ms. Jayshree V. Ullal,United States,,FALSE,FALSE,TRUE,https://www.arista.com,,USD,5115,Santa Clara,CA,408 547 5500,5453 Great America Parkway,0.0,2026-05-19T22:20:32
STX,Seagate Technology Holdings plc,733.35,164438327296,3629753,3992875,719.95,695.14,745.98,733.35,-7.490000000000009,-1.011,740.84,2026-05-19,841.31,103.73,2.009,224228992,69.71007,10.52,Technology,Computer Hardware,"Seagate Technology Holdings plc engages in the provision of data storage technology and infrastructure solutions in Singapore, the United States, the Netherlands, and internationally. The company offers mass capacity storage products, including enterprise nearline hard disk drives (HDDs), enterprise nearline solid state drives (SSDs), enterprise nearline systems, video and image HDDs, and network-attached storage drives. It also offers legacy applications comprising Mission Critical HDDs and SSDs; external storage solutions under the Seagate Ultra Touch, One Touch, Expansion, and Basics product lines, as well as under the LaCie brand name; desktop drives for personal computers and workstation applications; notebook drives traditional notebooks, convertible systems, and external storage applications, DVR HDDs for video streaming applications, and gaming SSDs for gaming rigs. In addition, the company provides Lyve edge-to-cloud mass capacity platform, that includes modular hardware and s",NMS,Dr. William David Mosley Ph.D.,Singapore,,FALSE,FALSE,TRUE,https://www.seagate.com,,USD,30000,Singapore,,65 6018 2562,121 Woodlands Avenue 5,0.4,2026-05-19T22:20:32
XLE,State Street Energy Select Sector SPDR ETF,61.29,41394286592,30890346,53460462,60.81,60.3,61.49,61.29,0.7100000000000009,1.172,60.58,2026-05-19,63.46,40.36,0.12,186424000,22.283533,,,,"In seeking to track the performance of the index, the fund employs a replication strategy. It generally invests substantially all, but at least 95%, of its total assets in the securities comprising the index. The index includes companies that have been identified as Energy companies by the GICS®, including securities of companies from the following industries: oil, gas and consumable fuels; and energy equipment and services. It is non-diversified.",PCX,,,,TRUE,FALSE,TRUE,,,USD,,,,,,2.5,2026-05-19T22:20:32
XLP,State Street Consumer Staples Select Sector SPDR ETF,86.09,14545357824,11573969,15764306,85.82,85.16,86.695,86.09,0.18999999999999773,0.2212,85.9,2026-05-19,90.14,75.16,0.6,210172000,26.10873,,,,"In seeking to track the performance of the index, the fund employs a replication strategy. It generally invests substantially all, but at least 95%, of its total assets in the securities comprising the index. The index includes companies that have been identified as Consumer Staples companies by the GICS®. It is non-diversified.",PCX,,,,TRUE,FALSE,TRUE,,,USD,,,,,,2.58,2026-05-19T22:20:32
XLB,State Street Materials Select Sector SPDR ETF,49.04,7311751168,11611136,13756445,49.78,48.89,49.86,49.04,-1.1799999999999997,-2.3497,50.22,2026-05-19,54.14,42.035,0.95,71923696,24.767042,,,,"In seeking to track the performance of the index, the fund employs a replication strategy. It generally invests substantially all, but at least 95%, of its total assets in the securities comprising the index. The index includes securities of companies from the following industries: chemicals; metals and mining; paper and forest products; containers and packaging; and construction materials. The fund is non-diversified.",PCX,,,,TRUE,FALSE,TRUE,,,USD,,,,,,1.7,2026-05-19T22:20:32
XLI,State Street Industrial Select Sector SPDR ETF,168.74,30091372544,7464694,11837039,169.63,168.11,170.17,168.74,-2.009999999999991,-1.1772,170.75,2026-05-19,179.31,139.63,1.15,136626000,29.156813,,,,"Under normal market conditions, the fund generally invests substantially all, but at least 95%, of its total assets in the securities comprising the index. The index includes companies that have been identified as Industrial companies by the Global Industry Classification Standard, including securities of companies from the following industries: aerospace and defense; industrial conglomerates; marine transportation. It is non-diversified.",PCX,,,,TRUE,FALSE,TRUE,,,USD,,,,,,1.17,2026-05-19T22:20:32
XLU,State Street Utilities Select Sector SPDR ETF,44.34,24051787776,20951149,24654519,43.82,43.62,44.4,44.34,0.4000000000000057,0.9103,43.94,2026-05-19,47.8,39.585,0.58,163274000,21.52433,,,,"In seeking to track the performance of the index, the fund employs a replication strategy. It generally invests substantially all, but at least 95%, of its total assets in the securities comprising the index. The index includes securities of companies from the following industries: electric utilities; water utilities; multi-utilities; independent power and renewable electricity producers; and gas utilities. The fund is non-diversified.",PCX,,,,TRUE,FALSE,TRUE,,,USD,,,,,,2.54,2026-05-19T22:20:32
XLRE,State Street Real Estate Select Sector SPDR ETF,43.94,7712990720,4031823,7500640,43.715,43.515,44.035,43.94,0.18999999999999773,0.4343,43.75,2026-05-19,44.91,39.725,1.06,,32.225323,,,,"Under normal market conditions, the fund generally invests substantially all, but at least 95%, of its total assets in the securities comprising the index. The index includes companies that have been identified as Real Estate companies by the Global Industry Classification Standard (GICS®). The fund is non-diversified.",PCX,,,,TRUE,FALSE,TRUE,,,USD,,,,,,3.15,2026-05-19T22:20:32
XLC,State Street Communication Services Select Sector SPDR ETF,115.85,25642762240,5143260,6606313,116.95,115.715,117.14,115.85,-1.1300000000000097,-0.966,116.98,2026-05-19,120.405,99.6,0.83,,17.061346,,,,"Normally, the fund generally invests substantially all, but at least 95%, of its total assets in the securities comprising the index. The index includes companies that have been identified as Communication Services companies by the GICS®, including securities of companies from the following industries: diversified telecommunication services; wireless telecommunication services; media; entertainment; and interactive media & services. The fund is non-diversified.",PCX,,,,TRUE,FALSE,TRUE,,,USD,,,,,,1.2,2026-05-19T22:20:32
XLV,State Street Health Care Select Sector SPDR ETF,147.32,37880406016,11930920,12281204,145.62,144.85,148.065,147.32,1.5999999999999943,1.098,145.72,2026-05-19,160.59,127.96,0.58,197415008,27.155819,,,,"In seeking to track the performance of the index, the fund employs a replication strategy. It generally invests substantially all, but at least 95%, of its total assets in the securities comprising the index. The index includes companies from the following industries: pharmaceuticals; health care equipment & supplies; health care providers & services; biotechnology; life sciences tools & services; and health care technology. The fund is non-diversified.",PCX,,,,TRUE,FALSE,TRUE,,,USD,,,,,,1.72,2026-05-19T22:20:32
XLY,State Street Consumer Discretionary Select Sector SPDR ETF,115.03,23127506944,8312708,10060359,115.13,114.195,115.315,115.03,-1.289999999999992,-1.109,116.32,2026-05-19,125.01,103.855,1.18,120253000,29.578444,,,,"The Advisor employs a replication strategy. The fund generally invests substantially all, but at least 95%, of its total assets in the securities comprising the index. The index includes companies that have been identified as Consumer Discretionary companies by the Global Industry Classification Standard (GICS®). It is non-diversified.",PCX,,,,TRUE,FALSE,TRUE,,,USD,,,,,,0.75,2026-05-19T22:20:32
XLK,State Street Technology Select Sector SPDR ETF,173.24,103332429824,15634315,14680639,172.68,170.831,175.18,173.24,-1.1200000000000045,-0.6423,174.36,2026-05-19,180.22,112.55,1.26,272056000,37.963795,,,,"In seeking to track the performance of the index, the fund employs a replication strategy, which means that the fund typically invests in substantially all of the securities represented in the index in approximately the same proportions as the index. It generally invests substantially all, but at least 95%, of its total assets in the securities comprising the index. The fund is non-diversified.",PCX,,,,TRUE,FALSE,TRUE,,,USD,,,,,,0.48,2026-05-19T22:20:32
XLF,State Street Financial Select Sector SPDR ETF,51.1,51460583424,35473981,47809370,51.63,51.05,51.79,51.1,-0.6400000000000006,-1.237,51.74,2026-05-19,56.52,47.67,0.85,883444992,16.482962,,,,"The fund generally invests substantially all, but at least 95%, of its total assets in the securities comprising the index. The index includes companies that have been identified as Financial companies by the Global Industry Classification Standard, including securities of companies from the following industries: financial services; insurance; banks; capital markets; mortgage real estate investment trusts; and consumer finance. The fund is non-diversified.",PCX,,,,TRUE,FALSE,TRUE,,,USD,,,,,,1.52,2026-05-19T22:20:32
TCEHY,Tencent Holdings Limited,58.61,529587961856,698620,4101008,59.025,58.37,59.15,58.61,1.1799999999999997,2.0547,57.43,2026-05-19,87.68,57.01,0.753,9035795960,16.50986,3.55,Communication Services,Internet Content & Information,"Tencent Holdings Limited, an investment holding company, provides value-added services, marketing services, fintech, and business services in Mainland China and internationally. The company's consumers business includes communications and social services, such as instant messaging and social networks; digital content, including online games, videos, live streaming, news, music, and literature; fintech services, which include mobile payment, wealth management, consumer loans, and securities trading; and various tools comprising network security management, browsing, navigation, application management, email, etc. Its enterprise business comprises marketing solutions, which offer digital tools, including user insight, creative management, placement strategy, and digital assets management; and cloud services, such as cloud computing, big data analytics, artificial intelligence, Internet of Things, and security and other technologies for financial services, education, healthcare, retail, i",PNK,Mr. Huateng  Ma,China,,FALSE,FALSE,TRUE,https://www.tencent.com,,USD,114848,Shenzhen,,86 755 8601 3388,Tencent Binhai Towers,1.18,2026-05-19T22:20:32
GDXG,,,,,,,,,,,,,,,,,,,,,,,,,,,,,,,,,,,,,,,
UCO,ProShares Ultra Bloomberg Crude Oil,51.96,450359808,3972065,10536726,52.63,50.87,52.84,51.96,1.3400000000000034,2.6472,50.62,2026-05-19,52.94,18.12,2.82,,,,,,"The fund seeks to meet its investment objective by investing, under normal market conditions, in any one of, or combinations of, Financial Instruments (including swap agreements, futures contracts, forward contracts, and option contracts) based on WTI sweet, light crude oil. It will not invest directly in oil.",PCX,,,,TRUE,FALSE,TRUE,,,USD,,,,240-497-6400,,0.0,2026-05-19T22:20:32
SCO,ProShares UltraShort Bloomberg Crude Oil,5.83,1059823040,48503146,46169781,5.75,5.73,5.94,5.83,-0.15000000000000036,-2.5084,5.98,2026-05-19,21.47,5.71,-2.43,,,,,,"The fund seeks to meet its investment objective by investing, under normal market conditions, in any one of, or combinations of, Financial Instruments (including swap agreements, futures contracts, forward contracts, and option contracts) based on WTI sweet, light crude oil. It will not invest directly in oil.",PCX,,,,TRUE,FALSE,TRUE,,,USD,,,,240-497-6400,,0.0,2026-05-19T22:20:32
PBRG,Leverage Shares 2X Long PBR Daily ETF,43.9776,2853962,2798,10632,44.28,43.13,44.28,43.9776,-0.8522999999999996,-1.9012,44.8299,2026-05-19,52.49,14.833,0.0,,,,,,"The fund is an actively managed ETF. The fund invests at least 80% of its net assets (plus borrowings for investment purposes) in the Underlying Security and financial instruments with economic characteristics that, in combination, provide 200% daily leveraged exposure to the price of PBR, consistent with the fund’s investment objective. The fund is non-diversified.",NGM,,,,TRUE,FALSE,TRUE,,,USD,,,,,,0.0,2026-05-19T22:20:32
CTM,"Castellum, Inc.",0.6515,61696356,1406911,1318445,0.6533,0.635,0.696,0.6515,-0.006700000000000039,-1.0179,0.6582,2026-05-19,1.56,0.48,-4.44,94698939,32.575,-0.02,Technology,Information Technology Services,"Castellum, Inc., together with its subsidiaries, operates as a technology company in the United States and internationally. It offers intelligence analysis, software development and engineering, program management, strategic and mission planning, information assurance, cybersecurity and policy support, data analytics, and model-based systems engineering services. The company's products and services are used in information technology, electronic warfare, information warfare, and cybersecurity areas. It serves defense, intelligence, civilian agencies, and local and federal governments, as well as financial services, healthcare, and other users of large data applications. The company is based in Vienna, Virginia.",ASE,Mr. Glen R. Ives,United States,,FALSE,FALSE,TRUE,https://www.castellumus.com,,USD,244,Vienna,VA,703 752 6157,1934 Old Gallows Road,0.0,2026-05-19T22:20:32
BZFD,"BuzzFeed, Inc.",1.31,49306732,2410620,2982096,1.35,1.25,1.4599,1.31,-0.06999999999999984,-5.0725,1.38,2026-05-19,2.68,0.54,,36296018,-6.5499997,-1.6,Communication Services,Internet Content & Information,"BuzzFeed, Inc., a digital media company, distributes content across owned and operated, and third-party platforms in the United States and internationally. The company offers BuzzFeed that provides entertainment, pop culture, and the internet with articles, lists, quizzes, videos, and original series; Tasty, a platform for food content; and HuffPost, a media platform for news, politics, opinion, entertainment, features, and lifestyle content. It also provides display, programmatic, and video advertising on its owned and operated sites and applications, as well as feature films, micro-dramas, content licensing, TV projects, and other projects. BuzzFeed, Inc. was founded in 2006 and is headquartered in New York, New York.",NCM,Mr. Jonah  Peretti,United States,,FALSE,FALSE,TRUE,https://www.buzzfeed.com,,USD,507,New York,NY,646 397 2039,50 West 23rd Street,0.0,2026-05-19T22:20:32
USBC,"USBC, Inc.",0.4458,173034784,639735,1903455,0.46,0.4147,0.4769,0.4458,0.0030999999999999917,0.7002,0.4427,2026-05-19,5.36,0.31,,388144429,,-0.39,Technology,Scientific & Technical Instruments,"USBC, Inc., together with its subsidiaries, operates in digital financial technologies business in United States. The company develops transformative financial services, including digital assets, banking solutions, and non-invasive health monitoring research. It serves retail users, fintech partners, and institutional counterparties. The company was formerly known as Know Labs, Inc. and changed its name to USBC, Inc. in August 2025. USBC, Inc. was incorporated in 1998 and is based in Reno, Nevada.",ASE,Mr. Robert Gregory Kidd,United States,,FALSE,FALSE,TRUE,https://investors.usbc.xyz,,USD,16,Reno,NV,775 239 7673,300 E 2nd Street,0.0,2026-05-19T22:20:32
MGTN,,,,,,,,,,,,,,,,,,,,,,,,,,,,,,,,,,,,,,,
XLRSR,,,,,,,,,,,,,,,,,,,,,,,,,,,,,,,,,,,,,,,
XLG,Invesco S&P 500 Top 50 ETF,63.02,10674111488,2297452,3432973,63.28,62.87,63.405,63.02,-0.5,-0.7872,63.52,2026-05-19,64.33,47.93,1.04,,30.050575,,,,"The fund generally will invest at least 90% of its total assets in the securities that comprise the underlying index. The index provider compiles, maintains and calculates the underlying index, which consists of the 50 largest companies in the S&P 500® Index based on float-adjusted market capitalization. The underlying index's components are weighted by float-adjusted market capitalization. The fund is non-diversified.",PCX,,,,TRUE,FALSE,TRUE,,,USD,,,,,,0.63,2026-05-19T22:20:32
QQQ,Invesco QQQ Trust,701.53,440257380352,45651018,56650606,699.81,695.27,706.49,701.53,-4.350000000000023,-0.6163,705.88,2026-05-19,722.03,505.58,1.18,393100000,34.22162,,,,"To maintain the correspondence between the composition and weights of the securities in the trust (the ""securities"") and the stocks in the NASDAQ-100 Index®, the adviser adjusts the securities from time to time to conform to periodic changes in the identity and/or relative weights of index securities. The composition and weighting of the securities portion of a portfolio deposit are also adjusted to conform to changes in the index.",NGM,,,,TRUE,FALSE,TRUE,,,USD,,,,,,0.42,2026-05-19T22:20:32
NDX,NASDAQ 100 PR USD,17421.0,,0,0,0.0,0.0,0.0,17421.0,16.799999999999272,0.0965,17404.2,2026-05-19,17596.27,0.0,,,,,,,,NGM,,,,FALSE,FALSE,TRUE,,,USD,,,,,,,2026-05-19T22:20:32
RUT,,,,,0,,,,,,,,2026-05-19,1.022,1.022,,,,,,,,YHD,,,,FALSE,TRUE,TRUE,,,,,,,,,,2026-05-19T22:20:32
XSP,,,,,0,,,,,,,,2026-05-19,0.347,0.347,,,,,,,,NMS,,,,FALSE,FALSE,TRUE,,,,,,,,,,2026-05-19T22:20:32
CVNA,Carvana Co.,63.35,69484544000,11673375,14231401,65.34,61.73,65.93,63.35,-2.6699999999999946,-4.0442,66.02,2026-05-19,97.378,54.464,3.55,716288385,36.831394,1.72,Consumer Cyclical,Auto & Truck Dealerships,"Carvana Co., together with its subsidiaries, operates an e-commerce platform for buying and selling used cars. It provides vehicle acquisition, inspection and reconditioning, online search and shopping experience, financing, complementary products, logistics network and distinctive fulfillment experience, and post-sale customer support services. The company also operates auction sites. Carvana Co. was founded in 2012 and is based in Tempe, Arizona.",NYQ,Mr. Ernest C. Garcia III,United States,,FALSE,FALSE,TRUE,https://www.carvana.com,,USD,23100,Tempe,AZ,602 922 9866,300 East Rio Salado Parkway,0.0,2026-05-19T22:20:32
FNDA,Schwab Fundamental U.S. Small Company ETF,34.61,10220108800,524248,1371054,34.78,34.475,34.8499,34.61,-0.3500000000000014,-1.0011,34.96,2026-05-19,36.32,26.96,1.16,,18.626509,,,,"The fund normally will invest at least 90% of its net assets (including, for this purpose, any borrowings for investment purposes) in stocks included in the index. The index measures the performance of the small company size segment by fundamental overall company scores (scores), which are created using as the universe the U.S. companies in the RAFI Global Equity Investable Universe (the parent universe).",PCX,,,,TRUE,FALSE,TRUE,,,USD,,,,1-800-435-4000,,1.1,2026-05-19T22:20:32
IMST,Bitwise MSTR Option Income Strategy ETF,11.25,17974986,4953,42745,11.385,11.25,11.385,11.25,-0.09999999999999964,-0.8811,11.35,2026-05-19,63.56,9.28,0.0,,,,,,The manager seeks to achieve these investment objectives through the use of a synthetic covered call strategy. The manager seeks to provide its synthetic exposure to the price return of MSTR through the purchase and sale of a combination of call and put option contracts that utilize MSTR as the reference asset. The fund is non-diversified.,PCX,,,,TRUE,FALSE,TRUE,,,USD,,,,,,170.22,2026-05-19T22:20:32
LI,Li Auto Inc.,16.18,16514349056,8343194,3274824,15.925,15.84,16.315,16.18,-0.5100000000000016,-3.0557,16.69,2026-05-19,32.025,15.71,0.618,843113992,101.12501,0.16,Consumer Cyclical,Auto Manufacturers,"Li Auto Inc. operates in the energy vehicle market in the People's Republic of China. The company designs, develops, manufactures, and sells premium smart electric vehicles. Its product line comprises multi-purpose vehicles and sport utility vehicles. The company offers sales and after sales management, and technology development and corporate management services, as well as manufacturing equipment. It offers its products through online and offline channels. The company was formerly known as Leading Ideal Inc. and changed its name to Li Auto Inc. in July 2020. Li Auto Inc. was founded in 2015 and is headquartered in Beijing, the People's Republic of China.",NMS,Mr. Xiang  Li,China,,FALSE,FALSE,TRUE,https://www.lixiang.com,,USD,30728,Beijing,,86 10 8742 7209,11 Wenliang Street,0.0,2026-05-19T22:20:32
MTRX,Matrix Service Company,12.16,342107616,196040,283993,12.12,11.9,12.23,12.16,-0.0600000000000005,-0.491,12.22,2026-05-19,16.11,9.88,1.024,28133850,18.285713,-0.53,Industrials,Engineering & Construction,"Matrix Service Company provides engineering, fabrication, construction, and maintenance services to support critical energy infrastructure and industrial markets in the United States, Canada, and internationally. The company's Storage and Terminal Solutions segment offers engineering, procurement, fabrication, and construction services related to cryogenic, specialty tanks, and terminals for LNG, NGLs, hydrogen, ammonia, propane, butane, liquid nitrogen/liquid oxygen, and liquid petroleum; and plant work, truck and rail loading/offloading facilities, marine structures, and storage tank and terminal maintenance and repair, as well as undertakes work related to aboveground crude oil and refined product storage tanks and terminals. This segment also provides engineered specialty tank products, including geodesic domes, aluminum internal floating roofs, floating suction and skimmer systems, roof drain systems, and floating roof seals. Its Utility and Power Infrastructure segment undertakes",NMS,Mr. John R. Hewitt,United States,,FALSE,FALSE,TRUE,https://matrixservicecompany.com,,USD,2239,Tulsa,OK,918 838 8822,15 East 5th Street,0.0,2026-05-19T22:20:32
TSM,Taiwan Semiconductor Manufacturing Company Limited,392.61,2036232486912,14042879,13817922,389.51,385.075,398.875,392.61,-3.339999999999975,-0.8435,395.95,2026-05-19,421.97,190.03,1.264,5186400000,33.729378,11.64,Technology,Semiconductors,"Taiwan Semiconductor Manufacturing Company Limited, together with its subsidiaries, manufactures, packages, tests, and sells integrated circuits and other semiconductor devices in Taiwan, China, Europe, the Middle East, Africa, Japan, the United States, and internationally. It provides various wafer fabrication processes, such as processes to manufacture complementary metal- oxide-semiconductor (CMOS) logic, mixed-signal, radio frequency, embedded memory, bipolar CMOS mixed-signal, and others. The company also involved in providing customer and engineering support services; manufacturing of masks; investment in technology start-up companies; research, designing, developing, manufacturing, packaging, testing, and sale of color filters; and investment activities. Its products are used in high performance computing, smartphones, Internet of things, automotive, and digital consumer electronics. Taiwan Semiconductor Manufacturing Company Limited was incorporated in 1987 and is headquartered",NYQ,Dr. C. C.  Wei Ph.D.,Taiwan,,FALSE,FALSE,TRUE,https://www.tsmc.com,,USD,76907,Hsinchu City,,886 3 563 6688,Hsinchu Science Park,0.96,2026-05-19T22:20:32
COIN,"Coinbase Global, Inc.",193.45,50966482944,6916779,11499545,188.375,185.5301,195.53,193.45,4.009999999999991,2.1168,189.44,2026-05-19,444.65,139.36,3.381,222426875,70.8608,2.73,Financial Services,Financial Data & Stock Exchanges,"Coinbase Global, Inc. operates platform for crypto assets in the United States and internationally. It provides the primary financial account in the crypto economy for consumers; a brokerage platform with a pool of liquidity across the crypto marketplace for institutions; and a suite of products granting access to build onchain for developers. The company was founded in 2012 and is based in New York, New York.",NMS,Mr. Brian  Armstrong,United States,,FALSE,FALSE,TRUE,https://www.coinbase.com,,USD,4951,New York,NY,888 908 7930,One Madison Avenue,0.0,2026-05-19T22:20:32
