ticker,name,price,marketcap,volume,volumeavg,priceopen,low,high,close,change,changepct,closeyest,date,high52,low52,beta,shares,pe,eps,sector,industry,description,exchange,ceo,country,ipodate,isEtf,isFund,isActive,web_url,image,currency,employees,city,state,phone,address,dividend_yield,fetched_at
BA,The Boeing Company,215.01,169492873216,5282448,6878545,218.84,214.01,220.05,215.01,-5.600000000000023,-2.5384,220.61,2026-05-19,254.35,176.77,1.207,788302331,84.649605,2.54,Industrials,Aerospace & Defense,"The Boeing Company, together with its subsidiaries, designs, develops, manufactures, sells, services, and supports commercial jetliners, military aircraft, satellites, missile defense, human space flight and launch systems, and services worldwide. The company operates through three segments: Commercial Airplanes; Defense, Space & Security; and Global Services. The Commercial Airplanes segment develops, produces, and markets commercial jet aircraft for passenger and cargo requirements. The Defense, Space & Security segment engages in the research, development, production, and modification of manned and unmanned military aircraft and weapons systems; strategic defense and intelligence systems, which include strategic missile and defense systems, command, control, communications, computers, intelligence, surveillance and reconnaissance, cyber and information solutions, and intelligence systems; and satellite systems, such as government and commercial satellites, and space exploration. The",NYQ,Mr. Robert K. Ortberg,United States,,FALSE,FALSE,TRUE,https://www.boeing.com,,USD,182000,Arlington,VA,703-465-3500,929 Long Bridge Drive,0.0,2026-05-19T22:20:32
LMT,Lockheed Martin Corporation,526.63,121421717504,1105749,1569004,527.505,523.48,530.26,526.63,-1.67999999999995,-0.318,528.31,2026-05-19,692.0,410.11,0.1,230563608,25.49032,20.66,Industrials,Aerospace & Defense,"Lockheed Martin Corporation, an aerospace and defense company, engages in the research, design, development, manufacture, integration, and sustainment of technology systems, products, and services in the United States, Europe, Asia, the Middle East, and internationally. The company operates through four segments: Aeronautics; Missiles and Fire Control (MFC); Rotary and Mission Systems (RMS); and Space. The Aeronautics segment offers combat and air mobility aircraft, unmanned air vehicles, and related technologies. The MFC segment provides air and missile defense systems; tactical missiles and precision strike weapon systems; logistics; fire control systems; mission operations support, readiness, engineering support, and integration services; and ground vehicles. The RMS segment offers military and commercial helicopters, surface ships, sea and land-based missile defense systems, radar and laser systems, sea and air-based mission and combat systems, command and control mission solutions",NYQ,Mr. James D. Taiclet Jr.,United States,,FALSE,FALSE,TRUE,https://www.lockheedmartin.com,,USD,123000,Bethesda,MD,301 897 6000,6801 Rockledge Drive,2.61,2026-05-19T22:20:32
DE,Deere & Company,558.07,150738780160,1027877,1257783,562.57,554.05,563.59,558.07,-6.419999999999959,-1.1373,564.49,2026-05-19,674.19,433.0,0.969,270107282,31.493793,17.72,Industrials,Farm & Heavy Construction Machinery,"Deere & Company engages in the manufacture and distribution of various equipment worldwide. The company operates through four segments: Production and Precision Agriculture, Small Agriculture and Turf, Construction and Forestry, and Financial Services. The Production and Precision Agriculture segment provides four-wheel-drive track and row crop tractors, harvesters, cotton pickers and strippers, sugarcane harvesters and loaders, soil preparation, tillage, seeding, and crop care equipment, as well as application equipment, including sprayers and nutrient management, soil preparation machinery, and related attachments and service parts. The Small Agriculture and Turf segment offers specialty, utility, and compact tractors; self-propelled forage harvesters and attachments; rotary mowers, hay and forage equipment, and utility vehicles; turf and utility equipment, including riding lawn, commercial mowing, and golf course equipment, and utility vehicles, as well as implements for mowing, til",NYQ,Mr. John C. May II,United States,,FALSE,FALSE,TRUE,https://www.deere.com/en,,USD,73100,Moline,IL,309 765 8000,One John Deere Place,1.15,2026-05-19T22:20:32
UPS,"United Parcel Service, Inc.",96.83,82306105344,4301592,6298180,95.17,93.86,96.86,96.83,1.2999999999999972,1.3608,95.53,2026-05-19,122.41,82.0,1.049,746581816,15.668285,6.18,Industrials,Integrated Freight & Logistics,"United Parcel Service, Inc., a package delivery and logistics provider, offers transportation and delivery services. It operates through two segments, U.S. Domestic Package and International Package. The U.S. Domestic Package segment offers time-definite delivery services for express letters, documents, packages and palletized freight through air and ground services. The International Package segment provides small package operations in Europe, the Middle East and Africa, Canada and Latin America, and Asia. The company offers a range of guaranteed day- and time-definite international transportation services; day-definite services; cross-border ground package delivery; contract-only, e-commerce solutions for non-urgent, and cross-border shipments; and international service for urgent and palletized shipments. It also provides international air and ocean freight forwarding, contract logistics, customs brokerage and insurance, mail services, healthcare logistics, distribution, and post-sa",NYQ,Ms. Carol B. Tome,United States,,FALSE,FALSE,TRUE,https://www.ups.com,,USD,460000,Atlanta,GA,404 828 6000,"55 Glenlake Parkway, N.E.",6.87,2026-05-19T22:20:32
ETN,Eaton Corporation plc,371.88,144401006592,2949687,2640081,372.41,367.64,377.1699,371.88,-9.990000000000009,-2.6161,381.87,2026-05-19,435.43,311.9,1.24,388300000,36.35191,10.23,Industrials,Specialty Industrial Machinery,"Eaton Corporation plc operates as a power management company in the United States, Canada, Latin America, Europe, and the Asia Pacific. The company operates through Electrical Americas, Electrical Global, Aerospace, Vehicle, and eMobility segments. It offers electrical components, industrial components, power distribution and assemblies, residential products, single and three phase power quality and connectivity products, wiring devices, circuit protection products, utility power distribution products, and power reliability equipment; and hazardous duty electrical equipment, emergency lighting, fire detection, intrinsically safe explosion-proof instrumentation, and structural support systems. It also provides pumps, motors, hydraulic power units, hoses and fittings, and electro-hydraulic pumps; valves, cylinders, electronic controls, electromechanical actuators, sensors, aircraft flap and slat systems, and nose wheel steering systems; hose, thermoplastic tubing products, fittings, adap",NYQ,Mr. Paulo Ruiz Sternadt,Ireland,,FALSE,FALSE,TRUE,https://www.eaton.com,,USD,97303,Dublin,,353 1 637 2900,Eaton House,1.15,2026-05-19T22:20:32
NOC,Northrop Grumman Corporation,556.34,79018909696,821947,820449,552.95,550.08,557.09,556.34,6.340000000000032,1.1527,550.0,2026-05-19,774.0,468.29,-0.113,142033476,17.440126,31.9,Industrials,Aerospace & Defense,"Northrop Grumman Corporation operates as an aerospace and defense technology company in the United States, Asia/Pacific, Europe, and internationally. It operates through four segments: Aeronautics Systems, Defense Systems, Mission Systems and Space Systems. The Aeronautics Systems segment designs, develops, produces, integrates, sustains, and modernizes aircraft systems. This segment also offers unmanned autonomous aircraft systems, including high-altitude long-endurance strategic, surveillance and reconnaissance systems; and strategic long-range strike aircraft, tactical fighter and air dominance aircraft, and airborne battle management and command and control systems. Its Defense Systems segment designs, develops, integrates, and produces strategic deterrent systems, tactical weapons, and missile defense solutions; and provides sustainment, modernization, and training services for manned and unmanned aircraft and electronics systems. This segment also offers strategic missiles; integ",NYQ,Ms. Kathy J. Warden,United States,,FALSE,FALSE,TRUE,https://www.northropgrumman.com,,USD,95000,Falls Church,VA,703 280 2900,2980 Fairview Park Drive,1.68,2026-05-19T22:20:32
WM,"Waste Management, Inc.",222.34,89286352896,2530442,2128631,224.15,221.86,227.66,222.34,-0.38999999999998636,-0.1751,222.73,2026-05-19,248.13,194.11,0.495,401575752,32.223186,6.9,Industrials,Waste Management,"Waste Management, Inc., through its subsidiaries, provides environmental solutions to residential, commercial, industrial, and municipal customers in the United States, Canada, Western Europe, and internationally. It offers collection services, including picking up and transporting waste and recyclable materials from where it was generated to a transfer station, recovery facility, or disposal site; owns and operates transfer stations; and owns, develops, and operates landfill gas-to-energy facilities that produce renewable electricity and renewable natural gas. It also operates materials processing and commodities recycling services, including cardboard, paper, glass, metals, plastics, construction and demolition materials, and other recycling commodities are recovered for resale or redirected for other purposes; markets and resells recycling commodities; recycling brokerage services, such as managing the marketing of recyclable materials for third parties; and other strategic business",NYQ,Mr. James C. Fish Jr.,United States,,FALSE,FALSE,TRUE,https://www.wm.com,,USD,60500,Houston,TX,713 512 6200,800 Capitol Street,1.59,2026-05-19T22:20:32
JPM,JPMorgan Chase & Co.,295.7,792331550720,7913316,9535742,301.09,295.27,301.79,295.7,-5.03000000000003,-1.6726,300.73,2026-05-19,337.25,256.0,1.023,2679511418,14.148326,20.9,Financial Services,Banks - Diversified,"JPMorgan Chase & Co. operates as a bank and financial holding company in the United States, rest of North America, Europe, the Middle East, Africa, the Asia Pacific, Latin America, and the Caribbean. It operates in three segments: Consumer & Community Banking, Commercial & Investment Bank, and Asset & Wealth Management. The company offers deposit, investment and lending products, and cash management; mortgage origination and servicing activities; residential mortgages and home equity loans; and credit cards, payment solutions, travel services, merchant offers, lifestyle benefits, auto loans, and leases to consumers and small businesses through bank branches, ATMs, and digital and telephone banking. It also provides investment banking, market-making, financing, custody, and securities products and services; corporate strategy and structure advisory, equity and debt market capital-raising, and loan origination and syndication services; cash and derivative instruments, risk management sol",NYQ,Mr. James  Dimon,United States,,FALSE,FALSE,TRUE,https://www.jpmorganchase.com,,USD,320079,New York,NY,212 270 6000,270 Park Avenue,2.0,2026-05-19T22:20:32
BAC,Bank of America Corporation,50.7,359797161984,44063830,38908263,50.725,50.375,51.275,50.7,0.010000000000005116,0.0197,50.69,2026-05-19,57.55,42.35,1.221,7096590651,12.580645,4.03,Financial Services,Banks - Diversified,"Bank of America Corporation, through its subsidiaries, provides various financial products and services for individual consumers, small and middle-market businesses, institutional investors, large corporations, and governments worldwide. It operates through four segments: Consumer Banking, Global Wealth & Investment Management (GWIM), Global Banking, and Global Markets. The Consumer Banking segment offers traditional and money market savings accounts, certificates of deposit and IRAs, checking accounts, and investment accounts and products; credit and debit cards; residential mortgages and home equity loans; and direct and indirect loans. The GWIM segment provides investment management, brokerage, banking, and trust and retirement products and services; wealth management solutions; and customized solutions, including specialty asset management services. The Global Banking segment offers lending products and services, including commercial loans, leases, commitment facilities, trade fina",NYQ,Mr. Brian Thomas Moynihan,United States,,FALSE,FALSE,TRUE,https://www.bankofamerica.com,,USD,212000,Charlotte,NC,(704) 386-5681,Bank of America Corporate Center,2.21,2026-05-19T22:20:32
WFC,Wells Fargo & Company,74.55,228137140224,18643561,18009919,74.48,73.85,75.345,74.55,0.1799999999999926,0.242,74.37,2026-05-19,97.76,71.9,0.96,3060189494,11.522412,6.47,Financial Services,Banks - Diversified,"Wells Fargo & Company, a financial services company, provides diversified banking, investment, mortgage, and consumer and commercial finance products and services in the United States and internationally. It operates through four segments: Consumer Banking and Lending; Commercial Banking; Corporate and Investment Banking; and Wealth and Investment Management. The company's financial products and services includes checking and savings accounts, and credit and debit cards, as well as home, auto, personal, and small business lending services. It also provides personalized wealth management, brokerage, financial planning, lending, private banking, trust and fiduciary products and services; and financial solutions to private, family owned and public companies through products and services including banking and credit products across multiple industry sectors and municipalities, secured lending and lease products, and treasury management. In addition, it offers a suite of capital markets, ba",NYQ,Mr. Charles W. Scharf,United States,,FALSE,FALSE,TRUE,https://www.wellsfargo.com,,USD,200999,San Francisco,CA,415-371-2921,333 Market Street,2.42,2026-05-19T22:20:32
GS,"The Goldman Sachs Group, Inc.",928.74,273985191936,1407949,2174519,933.22,923.95,939.56,928.74,-17.620000000000005,-1.8619,946.36,2026-05-19,984.7,582.5,1.274,295007421,16.950903,54.79,Financial Services,Capital Markets,"The Goldman Sachs Group, Inc., a financial institution, provides a range of financial services for corporations, financial institutions, governments, and individuals in the Americas, Europe, the Middle East, Africa, and Asia. It operates through three segments: Global Banking & Markets, Asset & Wealth Management, and Platform Solutions. The Global Banking & Markets segment provides financial advisory services, including strategic advisory assignments related to mergers and acquisitions, divestitures, corporate defense activities, restructurings, and spin-offs; equity and debt underwriting of public offerings and private placements; relationship lending and acquisition financing; secured lending through structured credit and asset-backed lending, such as warehouse, residential and commercial mortgage, corporate, consumer, auto, and student loans; financing through securities purchased under agreements to resell; and commodity financing through structured transactions. This segment also ",NYQ,Mr. David M. Solomon,United States,,FALSE,FALSE,TRUE,https://www.goldmansachs.com,,USD,47000,New York,NY,212 902 1000,200 West Street,1.9,2026-05-19T22:20:32
MS,Morgan Stanley,189.58,299021664256,6288089,6430527,191.55,188.94,192.84,189.58,-3.109999999999985,-1.614,192.69,2026-05-19,197.5,123.88,1.207,1577284817,17.172102,11.04,Financial Services,Capital Markets,"Morgan Stanley, a financial holding company, provides various financial products and services to corporations, governments, financial institutions, and individuals in the Americas, Asia, Europe, the Middle East, and Africa. It operates through Institutional Securities, Wealth Management, and Investment Management segments. The company offers capital raising and financial advisory services, including services related to the underwriting of debt, equity securities, and other products, as well as advice on mergers and acquisitions, restructurings, and project finance. It also provides equity and fixed income products comprising sales, financing, prime brokerage, and market-making services; Asia wealth management; business-related investments services; originating corporate and commercial real estate loans, secured lending facilities, and extending securities-based and other financing; and research activities. In addition, the company offers financial advisor-led brokerage, investment advi",NYQ,Mr. Edward N. Pick,United States,,FALSE,FALSE,TRUE,https://www.morganstanley.com,,USD,84000,New York,NY,212 761 4000,1585 Broadway,2.08,2026-05-19T22:20:32
BLK,"BlackRock, Inc.",1036.3,160868990976,801973,788185,1074.46,1036.02,1084.0,1036.3,-49.580000000000155,-4.5659,1085.88,2026-05-19,1219.94,917.39,1.456,155233989,26.077002,39.74,Financial Services,Asset Management,"BlackRock, Inc. is a publicly owned investment manager. The firm primarily provides its services to institutional, intermediary, and individual investors including corporate, public, union, and industry pension plans, insurance companies, third-party mutual funds, endowments, public institutions, governments, foundations, charities, sovereign wealth funds, corporations, official institutions, and banks. It also provides global risk management and advisory services. The firm manages separate client-focused equity, fixed income, and balanced portfolios. It also launches and manages open-end and closed-end mutual funds, offshore funds, unit trusts, and alternative investment vehicles including structured funds. The firm launches equity, fixed income, balanced, and real estate mutual funds. It also launches equity, fixed income, balanced, currency, commodity, and multi-asset exchange traded funds. The firm also launches and manages hedge funds. It invests in the public equity, fixed income",NYQ,Mr. Laurence Douglas Fink,United States,,FALSE,FALSE,TRUE,https://www.blackrock.com,,USD,25400,New York,NY,212 810 5300,50 Hudson Yards,2.11,2026-05-19T22:20:32
C,Citigroup Inc.,119.97,204618072064,11078007,13764485,121.45,119.76,121.44,119.97,-2.4399999999999977,-1.9933,122.41,2026-05-19,135.29,71.65,1.124,1705576955,14.829419,8.09,Financial Services,Banks - Diversified,"Citigroup Inc., a diversified financial service holding company, provides various financial products and services to consumers, corporations, governments, and institutions. It operates through five segments: Services, Markets, Banking, U.S. Personal Banking, and Wealth. The Services segment includes treasury and trade solutions, which provides cash management, trade, and working capital solutions to multinational corporations, financial institutions, and public sector organizations; and securities services, such as cross-border support for clients, local market expertise, post-trade technologies, data solutions, and various securities services solutions. The Markets segment offers sales and trading services for equities, foreign exchange, rates, spread products, and commodities to corporate, institutional, and public sector clients; and market-making services, including asset classes, risk management solutions, financing, and prime brokerage. The Banking segment includes investment ban",NYQ,Ms. Jane Nind Fraser Ph.D.,United States,,FALSE,FALSE,TRUE,https://www.citigroup.com,,USD,224000,New York,NY,212 559 1000,388 Greenwich Street,1.96,2026-05-19T22:20:32
AXP,American Express Company,309.31,211050397696,2916674,3700432,310.74,307.63,312.99,309.31,-2.930000000000007,-0.9384,312.24,2026-05-19,387.49,281.46,1.084,682326443,19.30774,16.02,Financial Services,Credit Services,"American Express Company, together with its subsidiaries, operates as an integrated payments company in the United States, Europe, the Middle East and Africa, the Asia Pacific, Australia, New Zealand, Latin America, Canada, the Caribbean, and internationally. It operates through four segments: U.S. Consumer Services, Commercial Services, International Card Services, and Global Merchant and Network Services. The company offers credit and charge cards and complementary products and services, including travel, dining, and lifestyle and expense management products and services; and banking and other payment and financing products and services, including deposits and non-card lending. It also provides merchant acquisition and processing, servicing and settlement, fraud prevention, and point-of-sale marketing and information products and services, as well as network services. The company offers its products and services to consumers, small businesses, mid-sized companies, and large corporati",NYQ,Mr. Stephen Joseph Squeri,United States,,FALSE,FALSE,TRUE,https://www.americanexpress.com,,USD,76800,New York,NY,(212) 640-2000,200 Vesey Street,1.22,2026-05-19T22:20:32
SCHW,The Charles Schwab Corporation,91.81,159670026240,8680644,10262159,92.2,91.46,92.93,91.81,-0.5799999999999983,-0.6278,92.39,2026-05-19,107.5,85.76,0.797,1739135507,18.252483,5.03,Financial Services,Capital Markets,"The Charles Schwab Corporation, together with its subsidiaries, operates as a savings and loan holding company that provides wealth management, securities brokerage, banking, asset management, custody, and financial advisory services in the United States and internationally. The company operates in two segments, Investor Services and Advisor Services. It offers brokerage accounts with equity and fixed income trading, margin lending, options trading, futures and forex trading, and cash management capabilities, including money market funds, and certificates of deposit; third-party mutual funds through the Mutual Fund Marketplace and Mutual Fund OneSource service, as well as mutual fund trading and clearing services to broker-dealers; exchange-traded funds; advisory solutions for managed portfolios, separately managed accounts, customized personal advice for tailored portfolios, specialized planning, and full-time portfolio management; banking products comprising checking and savings acco",NYQ,"Mr. Richard Andrew Wurster C.F.A., CMT",United States,,FALSE,FALSE,TRUE,https://www.aboutschwab.com,,USD,33500,Westlake,TX,817 859 5000,3000 Schwab Way,1.39,2026-05-19T22:20:32
BX,Blackstone Inc.,114.26,139655659520,4807862,8418224,118.14,114.2,118.2361,114.26,-2.780000000000001,-2.3753,117.04,2026-05-19,190.09,101.73,1.634,742180737,29.297436,3.9,Financial Services,Asset Management,"Blackstone Inc. is an alternative asset management firm specializing in private equity, venture capital, real estate, hedge fund solutions, credit, secondary funds of funds, public debt and equity and multi-asset class strategies. The firm typically invests in early-stage, seed, middle market, mature, late venture, growth capital, emerging growth, turnaround, and later stage companies. It also provide capital markets services. The real estate segment specializes in opportunistic, core+ investments as well as debt investment opportunities collateralized by commercial real estate, and stabilized income-oriented commercial real estate across North America, Europe and Asia. Within fund of fund investments, it seeks to invest in private equity funds, venture capital funds, mezzanine funds, distressed debt/turnaround funds, secondary investment funds & real estate funds. The firm's corporate private equity business pursues transactions throughout the world across a variety of transaction typ",NYQ,"Mr. Stephen Allen Schwarzman B.A., M.B.A.",United States,,FALSE,FALSE,TRUE,https://www.blackstone.com,,USD,5285,New York,NY,(212) 583-5000,345 Park Avenue,4.25,2026-05-19T22:20:32
PGR,The Progressive Corporation,202.87,118544334848,2457538,2844959,204.57,202.65,206.8399,202.87,-1.1299999999999955,-0.5539,204.0,2026-05-19,289.96,191.75,0.295,584336464,10.313675,19.67,Financial Services,Insurance - Property & Casualty,"The Progressive Corporation operates as an insurance company in the United States. It writes insurance for personal autos and special lines products, including motorcycles, RVs, and watercraft; and personal residential property insurance for homeowners and renters. The company also writes auto-related liability and physical damage insurance for comprising dump trucks, log trucks, garbage trucks, tractors, trailers, straight trucks, tow trucks and wreckers, vans, pick-up trucks, and autos; business-related general liability and commercial property insurance for small businesses; and workers' compensation insurance for the transportation industry. In addition, it offers other specialty property-casualty insurance and provides related services; personal property reinsurance products; and involved in investment activities. It sells its products through independent insurance agencies, as well as online and over the phone. The Progressive Corporation was founded in 1937 and is headquartered ",NYQ,Ms. Susan Patricia Griffith,United States,,FALSE,FALSE,TRUE,https://www.progressive.com,,USD,70053,Mayfield,OH,440 461 5000,300 North Commons Blvd.,6.81,2026-05-19T22:20:32
